DROP DATABASE
CREATE DATABASE
DROP TABLE
DROP TABLE
DROP TABLE
CREATE TABLE
CREATE TABLE
CREATE TABLE
CREATE PROCEDURE
CREATE FUNCTION
CREATE PROCEDURE
UPDATE 5000
SET
CREATE PROCEDURE
CREATE PROCEDURE
CREATE PROCEDURE
CREATE PROCEDURE
CALL
         avg         
---------------------
 0.01895999938249588
(1 row)

         avg         
---------------------
 100000.000000000000
(1 row)

DROP DATABASE
CREATE DATABASE
DROP TABLE
DROP TABLE
DROP TABLE
CREATE TABLE
CREATE TABLE
CREATE TABLE
CREATE PROCEDURE
CREATE FUNCTION
CREATE PROCEDURE
UPDATE 5000
SET
CREATE PROCEDURE
CREATE PROCEDURE
CREATE PROCEDURE
CREATE PROCEDURE
CALL
         avg          
----------------------
 0.011449999995529652
(1 row)

         avg         
---------------------
 100000.000000000000
(1 row)

DROP DATABASE
CREATE DATABASE
DROP TABLE
DROP TABLE
DROP TABLE
CREATE TABLE
CREATE TABLE
CREATE TABLE
CREATE PROCEDURE
CREATE FUNCTION
CREATE PROCEDURE
UPDATE 5000
SET
CREATE PROCEDURE
CREATE PROCEDURE
CREATE PROCEDURE
CREATE PROCEDURE
CALL
         avg         
---------------------
 0.07684999868273736
(1 row)

         avg          
----------------------
 1000000.000000000000
(1 row)

DROP DATABASE
CREATE DATABASE
DROP TABLE
DROP TABLE
DROP TABLE
CREATE TABLE
CREATE TABLE
CREATE TABLE
CREATE PROCEDURE
CREATE FUNCTION
CREATE PROCEDURE
UPDATE 5000
SET
CREATE PROCEDURE
CREATE PROCEDURE
CREATE PROCEDURE
CREATE PROCEDURE
CALL
         avg         
---------------------
 0.03404000084847212
(1 row)

         avg          
----------------------
 1000000.000000000000
(1 row)

